{
  "agent": "playtester",
  "verdict": "targets_missed",
  "summary": "The config flies, but the endgame's whole gate — base heat capacity above a full hold's plunge and below the module's best skimmed descent — is a measured window only 8.8 bar units wide (180.1 to 188.9), narrower than the skim-altitude scan's own noise, and three params claims (optimal_skims, cost_curve, full-hold descent speed) are contradicted by the flight.",
  "findings": [
    {
      "id": "endgame_capacity_window_is_8_8_bar_units",
      "gdd_ref": "2.2",
      "claim": "GDD 2.2: a 32% window separates the full hold's plunge (203.7) from the module's (268.8), 'bounded by a rule rather than by how finely anyone searched, which is why it is safe to build on'; the same section rejects a 4%-wide window as 'a coincidence and not a mechanic'. reentry.heat_capacity 185 is supposed to sit comfortably inside it.",
      "measured": "Flown from the top of the band at commit_floor_m 8000: full hold (805.5 kg) plunges at 180.1 and the module's cheapest skimmed descent is 188.9 (2 skims; 265.3 plunge, 203.4 at 1 skim, 200.9 at 3). The base capacity must exceed 180.1 and stay under 188.9 — a window of 8.8 units, 4.9%. 185 clears the full hold by 2.7% and undercuts the module by 2.1%. The heaviest ordinary piece (828 kg) plunges at 181.0, 2.2% under the bar. The balancer's 23%/7.7% margins were computed against a 104.1 kg hold; the simulator flew 805.5 kg.",
      "severity": "blocking",
      "kind": "tuning"
    },
    {
      "id": "full_hold_doubling_excludes_the_endgame_gate",
      "gdd_ref": "2.4",
      "claim": "GDD 2.4/2.6: a full hold roughly doubles ship mass, and the module (3,600 kg) is the piece that 'costs a maxed hold's mass budget'. The params' catalog concern proposes rescaling slot mass upward to make this true.",
      "measured": "The sweep's own hold model gives kg_per_slot 134.25, full_hold_kg 805.5, full_hold_mass_ratio 1.58 — against the params' 17.357 kg/slot and 1.074. Neither reaches 2.0, and making it true is worse than leaving it: top-of-band plunge peak measures 144.7 at 0 kg, 163.5 at 402.8 kg, 180.1 at 805.5 kg and 265.3 at 3,600 kg, so a doubling hold (~1,400 kg of cargo) extrapolates to roughly 200 bar units on a plunge — above the module's best skimmed descent of 188.9. No heat capacity can then permit the full hold's plunge and forbid the module's. The two claims are mutually exclusive at any dry mass.",
      "severity": "significant",
      "kind": "design"
    },
    {
      "id": "optimal_skims_and_cost_curve_contradicted_by_flight",
      "gdd_ref": "2.2",
      "claim": "ablation.optimal_skims is 1 at bottom, middle and top, and ablation.cost_curve gives bottom [12.10, 10.39, 16.59, 23.52] — an argmin at one skim.",
      "measured": "cheapest_pass_count is 1 pass (i.e. zero skims, a plunge) in all 15 flown descent cells, at every altitude and every load including the 3,600 kg endgame haul. The flown plate cost for an empty ship at the bottom runs [7.6, 11.6, 16.0, 20.9] against the emitted [12.10, 10.39, 16.59, 23.52]: the plunge is overstated by 4.5 points, the one-skim descent understated by 1.2, and the argmin is inverted. The flight agrees with GDD Rev-3's own statement that one pass is cheapest under every ablation keying; the params are the outlier, inherited from pricing the bottom sample off the top sample's 0.434 multiplier when the bottom's own measured value is 0.700.",
      "severity": "significant",
      "kind": "tuning"
    },
    {
      "id": "full_hold_descent_speed_claim_off_by_21_percent",
      "gdd_ref": "2.3",
      "claim": "landing.descent_speed_full_hold_ms 3.99, computed from the stated canopy (630 m2 at Cd 1.8) on a 1,504.1 kg all-up ship.",
      "measured": "4.83 m/s, delta 0.84 (21%), spread 0.0 across all three sample altitudes. The canopy is not implicated — the sweep flew the stated 630 m2 at Cd 1.8 independently — the disagreement is entirely the hold: 2,205.5 kg all-up against the params' 1,504.1. The design rule still passes (4.83 < 5.0 soft line) with 3.4% of margin instead of 20%, and empty lands at 3.85.",
      "severity": "significant",
      "kind": "tuning"
    },
    {
      "id": "altitude_difficulty_gradient_exists_only_because_of_the_commit_floor",
      "gdd_ref": "2.6",
      "claim": "GDD 2.6: 'the good stuff fights you on the tether and on the way down — height is where the money is, and the reentry risk rises with it on its own. That is the difficulty curve.'",
      "measured": "It does not rise on its own. With entry depth free, an empty ship's cheapest descent gets *easier* with altitude: 7.6% of plate and peak 70 from the bottom, 7.2% and 67 from the middle, 6.9% and 65 from the top — the planner simply picks a better braking altitude from a higher, slower orbit. Only with the entry pinned at commit_floor_m 8000 does the gradient invert to the designed direction: 93.2 / 114.2 / 144.7. The commit floor is not just the endgame's gate, it is the sole source of the campaign's difficulty curve, which is a stronger reason for its never-cut status than the GDD currently gives.",
      "severity": "significant",
      "kind": "design"
    },
    {
      "id": "top_of_band_unreachable_at_base_config_and_no_upgraded_ship_was_flown",
      "gdd_ref": "2.5",
      "claim": "GDD 2.5 and the balancer: the arc is the first launch's route, fuel tank tier 1 buys orbit at the floor and tier 2 circularises at the top with 9% left — the finale's ride.",
      "measured": "Bottom and middle confirm the balancer exactly: arc reached with 13.3% margin and a 125.9 s EVA window, and 5.1% at the middle (which also settles GDD 4.5's open 97 s question upward, to 125.9 s). The top sample fails outright — 'crashed on ascent', arc apex 192,203 m against a 215,000 m sample, 10.6% short, with climb_peak_heat logged as 0. Every top-of-band descent in this sweep was therefore flown from an altitude the flown ship cannot reach, and no upgraded flight configuration (tank, shield or parachute tier) was flown at all, so §3's questions 6 and 8 — module infeasible-as-plunge at every shield tier, module run beatable at full upgrades — remain unmeasured.",
      "severity": "significant",
      "kind": "tuning"
    },
    {
      "id": "module_lands_hard_on_every_canopy_flown",
      "gdd_ref": "2.6",
      "claim": "GDD 2.6: a hard touchdown degrades the module exactly one state, so 'a pristine module cannot be lost to a single bad flare'; pristine is a first-attempt-only triumph reachable near full upgrades.",
      "measured": "The module touches down at 7.28 m/s from all three sample altitudes on the base 630 m2 canopy — 46% over the 5.0 soft line, in a descent the sweep itself grades soft_landing false. Since the sweep flies a perfect pilot with no flare error, a competently-flown module delivery on the starter canopy loses a state on touchdown regardless of heat, so pristine is unreachable without parachute tier 2 (1,400 m2, unflown; predicted 4.88 m/s). This makes the parachute track, not the shield track, the gate on the triumph ending — which the GDD does not say anywhere.",
      "severity": "significant",
      "kind": "tuning"
    },
    {
      "id": "ordinary_cargo_never_lands_hard",
      "gdd_ref": "2.5",
      "claim": "GDD 2.5: 'Storage is double-edged: a bigger hold raises the profit ceiling and the difficulty of the flight home', with the hold-mass scale painted green/amber/red for soft/hard/destructive.",
      "measured": "Across the entire ordinary load range the touchdown speed moves 3.85 (empty) → 4.37 (half) → 4.83 (full) → 4.86 (heaviest ordinary piece, 828 kg), a 1.01 m/s spread that never crosses the 5.0 line. Only the 3,600 kg module (7.28) lands hard. At this canopy the mass scale has one zone for everything a player can actually haul, and greed is paid for in plate (7.6% → 10.4% at the bottom) and heat (70 → 90), not in landings.",
      "severity": "minor",
      "kind": "design"
    },
    {
      "id": "starter_shield_lesson_is_20_percent_of_the_bar",
      "gdd_ref": "4.4",
      "claim": "GDD 4.4 risk 3: the climb's peak is meant to be 'a visible, alarming, entirely survivable fraction' of the starter shield — 47.5 against the old capacity of 100, i.e. half the bar, chosen deliberately for the first-flight lesson.",
      "measured": "The climb peaks at 37.5 (bottom route) and 36.0 (middle) against reentry.heat_capacity 185 — 20.3% of the bar, a fifth rather than a half. The obvious fix is blocked: capacity 185 is pinned inside the 180.1–188.9 endgame window (finding 1) and cannot be lowered to sharpen the lesson without deleting the gate. The lever has to be the climb's heat, not the bar's capacity.",
      "severity": "minor",
      "kind": "tuning"
    },
    {
      "id": "skim_peak_constant_has_no_measured_support",
      "gdd_ref": "2.2",
      "claim": "ablation.skim_peak 46.7 charges every skim k * 0.0009 * 46.7^2 = 1.96% of plate in the cost curve; the balancer left it untouched because no measured value was reported.",
      "measured": "One is now reported and it is zero: skim_peak_heat is 0.0 in every row of every skim study at all three samples (bottom scanned to 27,950 m, middle 25,800 m, top 23,650 m), while entry_peak_heat matches ablation.heat_index exactly (100 / 125 / 160, delta 0.000). Either skims deposit no bar heat in this model or the field is unpopulated; in both readings 46.7 is unsupported, and the per-skim heat term is roughly 12% of a one-skim descent's emitted cost.",
      "severity": "minor",
      "kind": "tuning"
    },
    {
      "id": "unstaged_pass_survives_here_but_almost_nowhere_in_the_grid",
      "gdd_ref": "2.2",
      "claim": "GDD 2.2: staged vs unstaged braking is 'a real choice' — 3x heat bought with retained steering.",